{
  "$schema": "http://json-schema.org/draft-07/schema#",
  "$id": "https://clawrocket.dev/contracts/editorial-room/v0/scoring_pipeline.schema.json",
  "title": "ScoringPipelineCompiledTruth",
  "description": "Scoring pipeline page; references scorer ids and weights. See EDITORIAL_ROOM_CONTRACT.md §3.6.",
  "type": "object",
  "additionalProperties": false,
  "definitions": {
    "ScorerInPipeline": {
      "type": "object",
      "additionalProperties": false,
      "required": ["scorer_id", "role", "weight", "threshold", "params"],
      "properties": {
        "scorer_id": {
          "type": "string",
          "minLength": 1,
          "description": "e.g., 'autonovel_mechanical' | 'autonovel_judge' | 'ssr_core_local' | …"
        },
        "role": {
          "type": "string",
          "enum": ["gate", "score", "diagnostic"]
        },
        "weight": {
          "anyOf": [{ "type": "null" }, { "type": "number" }],
          "description": "For weighted_mean aggregation. Null when role != 'score'."
        },
        "threshold": {
          "anyOf": [
            { "type": "null" },
            {
              "type": "object",
              "additionalProperties": false,
              "required": ["score", "direction"],
              "properties": {
                "score": { "type": "string", "minLength": 1 },
                "direction": { "type": "string", "enum": ["score", "penalty"] }
              }
            }
          ],
          "description": "For gates."
        },
        "params": {
          "type": "object",
          "description": "Scorer-specific; see scorer_config schema (deferred)."
        }
      }
    }
  },
  "required": [
    "schema_version",
    "slug",
    "name",
    "description",
    "scorers",
    "aggregation_rule",
    "on_gate_fail"
  ],
  "properties": {
    "schema_version": { "const": "0" },
    "slug": {
      "type": "string",
      "minLength": 1,
      "description": "e.g., 'scoring_pipeline/gamemakers_default'."
    },
    "name": { "type": "string", "minLength": 1 },
    "description": { "type": "string", "minLength": 1 },
    "scorers": {
      "type": "array",
      "items": { "$ref": "#/definitions/ScorerInPipeline" }
    },
    "aggregation_rule": {
      "type": "string",
      "enum": ["weighted_mean", "min", "max", "first", "custom"]
    },
    "on_gate_fail": {
      "type": "string",
      "enum": ["short_circuit_with_diagnostic", "continue_with_warning"]
    }
  }
}
