{
  "schema_version": "0",
  "slug": "scoring_pipeline/gamemakers_default",
  "name": "GameMakers Default",
  "description": "Composite pipeline: rubric judge (Opus, 6 axes) + SSR (3 personas, likelihood family) + voice drift, with counter-audience disabled until Polish.",
  "scorers": [
    {
      "scorer_id": "rubric_judge_opus",
      "role": "score",
      "weight": 0.4,
      "threshold": null,
      "params": {
        "model_id": "claude-opus-4-7",
        "axes": ["stance", "claim", "source", "voice", "risk", "fit"]
      }
    },
    {
      "scorer_id": "ssr_core_local",
      "role": "score",
      "weight": 0.4,
      "threshold": null,
      "params": {
        "personas": [
          "persona/ankit-indie-dev",
          "persona/ravi-studio-lead",
          "persona/mei-publisher"
        ],
        "samples_per_persona": 8,
        "family": "likelihood"
      }
    },
    {
      "scorer_id": "voice_drift",
      "role": "score",
      "weight": 0.2,
      "threshold": null,
      "params": {
        "voice_slug": "voice/gamemakers-2026"
      }
    },
    {
      "scorer_id": "counter_audience",
      "role": "diagnostic",
      "weight": 0.0,
      "threshold": null,
      "params": {
        "enabled_phases": ["polish"]
      }
    },
    {
      "scorer_id": "specificity_gate",
      "role": "gate",
      "weight": null,
      "threshold": {
        "score": "3",
        "direction": "score"
      },
      "params": {}
    }
  ],
  "aggregation_rule": "weighted_mean",
  "on_gate_fail": "short_circuit_with_diagnostic"
}
